{
 "schema_version": 1,
 "package_version": "1.0.0",
 "id": "tarama-desenleri",
 "source": "Endüstri standardı tarama desenleri (ANSI 31–37, ISO çizgi desenleri); acad.pat ile aynı açı ve aralık tanımı, yönetmelik değeri değildir",
 "published": "2026-09-09",
 "licence": "GPL-3.0-or-later",
 "aciklama": "TARAMA komutunun ve DXF HATCH okuyucusunun adla bulduğu desenler. Her desen bir ya da daha çok ÇİZGİ AİLESİ: açı (mikroderece), taban noktası, bir çizgiden ötekine kayma (ailenin kendi çerçevesinde: x çizgi boyunca, y çizgiye dik) ve kesik dizisi. Uzunluklar desen mikrometresidir; TARAMA'nın olcek= oranıyla çarpılarak zemine iner. Kesik dizisi bu sürümde çizilmez, korunur.",
 "desenler": [
  { "id": "SOLID", "aciklama": "Dolu dolgu", "aileler": [] },
  { "id": "ANSI31", "aciklama": "45° tek yönlü çizgiler, 3,175 mm aralık (demir, tuğla, taş)",
    "aileler": [ { "aci_uderece": 45000000, "taban_um": [0, 0], "kayma_um": [0, 3175], "kesik_um": [] } ] },
  { "id": "ANSI32", "aciklama": "45° çift çizgi, 9,525 mm aralık (çelik)",
    "aileler": [ { "aci_uderece": 45000000, "taban_um": [0, 0], "kayma_um": [0, 9525], "kesik_um": [] },
                 { "aci_uderece": 45000000, "taban_um": [4490, 0], "kayma_um": [0, 9525], "kesik_um": [] } ] },
  { "id": "ANSI33", "aciklama": "45° çizgi ve kesikli çizgi, 6,35 mm aralık (bronz, pirinç, bakır)",
    "aileler": [ { "aci_uderece": 45000000, "taban_um": [0, 0], "kayma_um": [0, 6350], "kesik_um": [] },
                 { "aci_uderece": 45000000, "taban_um": [4490, 0], "kayma_um": [0, 6350], "kesik_um": [3175, -1588] } ] },
  { "id": "ANSI34", "aciklama": "45° dört çizgi, 19,05 mm aralık (plastik, kauçuk)",
    "aileler": [ { "aci_uderece": 45000000, "taban_um": [0, 0], "kayma_um": [0, 19050], "kesik_um": [] },
                 { "aci_uderece": 45000000, "taban_um": [4490, 0], "kayma_um": [0, 19050], "kesik_um": [] },
                 { "aci_uderece": 45000000, "taban_um": [8980, 0], "kayma_um": [0, 19050], "kesik_um": [] },
                 { "aci_uderece": 45000000, "taban_um": [13470, 0], "kayma_um": [0, 19050], "kesik_um": [] } ] },
  { "id": "ANSI37", "aciklama": "45° ve 135° çapraz çizgiler, 3,175 mm aralık (kurşun, çinko, magnezyum)",
    "aileler": [ { "aci_uderece": 45000000, "taban_um": [0, 0], "kayma_um": [0, 3175], "kesik_um": [] },
                 { "aci_uderece": 135000000, "taban_um": [0, 0], "kayma_um": [0, 3175], "kesik_um": [] } ] },
  { "id": "LINE", "aciklama": "Yatay paralel çizgiler, 3,175 mm aralık",
    "aileler": [ { "aci_uderece": 0, "taban_um": [0, 0], "kayma_um": [0, 3175], "kesik_um": [] } ] },
  { "id": "NET", "aciklama": "Yatay ve düşey kare ağ, 3,175 mm aralık",
    "aileler": [ { "aci_uderece": 0, "taban_um": [0, 0], "kayma_um": [0, 3175], "kesik_um": [] },
                 { "aci_uderece": 90000000, "taban_um": [0, 0], "kayma_um": [0, 3175], "kesik_um": [] } ] },
  { "id": "DOTS", "aciklama": "Nokta deseni, 1,5875 mm aralık",
    "aileler": [ { "aci_uderece": 0, "taban_um": [0, 0], "kayma_um": [794, 1588], "kesik_um": [0, -1588] } ] },
  { "id": "EARTH", "aciklama": "Toprak: 45° ve 135° kesikli çizgiler, 6,35 mm aralık",
    "aileler": [ { "aci_uderece": 45000000, "taban_um": [0, 0], "kayma_um": [6350, 6350], "kesik_um": [6350, -6350] },
                 { "aci_uderece": 135000000, "taban_um": [0, 0], "kayma_um": [6350, 6350], "kesik_um": [6350, -6350] } ] },
  { "id": "GRASS", "aciklama": "Çim: 45° ve 135° kısa çizgiler, 44,45 mm aralık",
    "aileler": [ { "aci_uderece": 90000000, "taban_um": [0, 0], "kayma_um": [17780, 17780], "kesik_um": [4763, -30797] },
                 { "aci_uderece": 45000000, "taban_um": [0, 0], "kayma_um": [0, 25146], "kesik_um": [3175, -47117] },
                 { "aci_uderece": 135000000, "taban_um": [0, 0], "kayma_um": [0, 25146], "kesik_um": [3175, -47117] } ] }
 ]
}
